{
  "metadata": {
    "id": "c172-overview",
    "title": "Conoce el Cessna 172",
    "subtitle": "Un avión de entrenamiento para aprender a observar antes de operar.",
    "objective": "Ubicar las referencias básicas del C172 que usarás durante las primeras prácticas en MSFS.",
    "estimatedTime": "16 min",
    "prerequisites": [
      "aircraft-three-axes"
    ],
    "level": 0,
    "module": "fundamentos",
    "visualStandardVersion": 3
  },
  "whyItMatters": "El C172 permite aprender relación entre controles, actitud e instrumentos con una carga de sistemas menor que un avión de línea. No es un A320 reducido: es tu plataforma de fundamentos.",
  "concepts": [
    {
      "term": "Actitud",
      "meaning": "Cómo está orientado el avión respecto al horizonte: morro, alas y dirección."
    },
    {
      "term": "PFD",
      "meaning": "Pantalla primaria de vuelo, cuando la variante del avión dispone de ella."
    },
    {
      "term": "Rampa",
      "meaning": "Zona donde el avión está estacionado; no es una pista de despegue."
    }
  ],
  "steps": [
    {
      "number": 1,
      "title": "Carga una situación inmóvil",
      "instruction": "En MSFS, elige el Cessna 172 y colócalo estacionado en una rampa o en otra posición segura.",
      "explanation": "Primero identificarás el puesto sin presión de velocidad, tráfico o navegación.",
      "expectedResult": "El avión está inmóvil y puedes cambiar de vista.",
      "simulatorAction": "Mantén potencia baja y freno aplicado antes de explorar controles.",
      "visual": {
        "type": "diagram",
        "asset": "content/assets/learning-loop.svg",
        "alt": "Ciclo conceptual de preparar, practicar, comprobar y repetir.",
        "purpose": "Mostrar la secuencia simple de una práctica segura antes de explorar la cabina.",
        "teaches": "Separar preparación, acción, comprobación y repetición en una sesión corta.",
        "userQuestionAnswered": [
          "queCambioEsperar"
        ],
        "tiedToStep": 1,
        "expectedObservation": "El ciclo empieza preparando una situación segura y termina comprobando el resultado antes de repetir.",
        "view": "flujo",
        "visualCategory": "conceptual",
        "fidelity": "conceptual",
        "recognitionGoal": "Reconoce el orden de una práctica segura, no un control físico ni una pantalla de MSFS.",
        "recognizedElements": [
          "prepara",
          "practica",
          "comprueba",
          "repite"
        ],
        "actionAfterViewing": "Carga el C172 estacionado y deja el freno aplicado antes de mirar cualquier control."
      },
      "requiredVisualCoverage": [
        {
          "type": "cockpit",
          "status": "notRequired",
          "reason": "El paso explica una relación o una decisión y no requiere reconocer una cabina, pantalla, instrumento o control concreto."
        }
      ]
    },
    {
      "number": 2,
      "title": "Reconoce lo que te informa el panel",
      "instruction": "Busca el indicador de actitud y el indicador de velocidad o sus equivalentes visibles en tu variante.",
      "explanation": "Todavía no memorices números: identifica qué instrumento te habla de actitud y cuál de velocidad.",
      "expectedResult": "Puedes señalar dos fuentes de información distintas.",
      "simulatorAction": "Si usas la variante con G1000, compara la pantalla con la referencia; no copies una posición de botón.",
      "visual": {
        "type": "instrumentDiagram",
        "asset": "content/assets/c172-straight-level-pfd-attitude.svg",
        "alt": "Referencia fiel de PFD G1000 con actitud, velocidad, altitud y rumbo claramente localizables.",
        "purpose": "Mostrar una PFD legible para reconocer las zonas de información de una cabina G1000.",
        "teaches": "Localizar actitud al centro, velocidad a la izquierda, altitud a la derecha y rumbo abajo.",
        "userQuestionAnswered": [
          "dondeMirar"
        ],
        "tiedToStep": 2,
        "expectedObservation": "La actitud está en el centro de la PFD; las cintas de velocidad y altitud la flanquean y el rumbo queda abajo.",
        "view": "instrumento",
        "visualCategory": "reference",
        "fidelity": "recreated-faithful",
        "recognitionGoal": "Reconoce las zonas de actitud y velocidad de una PFD G1000 sin copiar valores ni botones.",
        "recognizedElements": [
          "indicador de actitud",
          "cinta de velocidad",
          "cinta de altitud",
          "rumbo"
        ],
        "actionAfterViewing": "Localiza esas dos fuentes de información en tu variante y vuelve a la vista de cabina.",
        "quality": {
          "sourceWidth": 1600,
          "sourceHeight": 900,
          "intendedDisplayWidth": 760,
          "supportsZoom": true,
          "detailTarget": "La actitud central y la cinta de velocidad izquierda, ampliadas y etiquetadas en la referencia."
        },
        "coverage": [
          "instrument"
        ]
      },
      "warning": "La aviónica y la disposición pueden variar entre variantes y actualizaciones de MSFS.",
      "requiredVisualCoverage": [
        {
          "type": "instrument",
          "status": "required"
        }
      ]
    },
    {
      "number": 3,
      "title": "Haz un recorrido verbal del puesto",
      "instruction": "Desde la vista de cabina, señala y nombra: yoke, potencia, frenos, trim y el instrumento de actitud o PFD.",
      "explanation": "Nombrar una función antes de usarla reduce movimientos por ensayo y error en el siguiente ejercicio.",
      "expectedResult": "Puedes ubicar cinco elementos por función, aunque su aspecto cambie.",
      "simulatorAction": "Usa la ayuda interactiva de MSFS si necesitas identificar un control; verifica con el perfil activo.",
      "visual": {
        "type": "controlHighlight",
        "asset": "public/references/turtlebeach-velocityone-official.png",
        "alt": "Referencia real del VelocityOne: yoke frontal, cuadrante de potencia y pantalla FMD.",
        "purpose": "Dar una referencia nítida del hardware que el alumno debe identificar antes de comprobar sus asignaciones.",
        "teaches": "Distinguir el yoke y el cuadrante de potencia del hardware real sin inventar asignaciones.",
        "userQuestionAnswered": [
          "queControlTocar"
        ],
        "tiedToStep": 3,
        "expectedObservation": "El yoke aparece al frente y las palancas de potencia están agrupadas en el cuadrante a la derecha.",
        "view": "controlFisico",
        "visualCategory": "reference",
        "fidelity": "real",
        "recognitionGoal": "Reconoce el yoke y el cuadrante VelocityOne; confirma frenos y trim en tu perfil activo.",
        "recognizedElements": [
          "yoke VelocityOne",
          "cuadrante de potencia",
          "pantalla FMD"
        ],
        "actionAfterViewing": "Vuelve a la cabina de MSFS y usa la ayuda interactiva o Controles para confirmar trim y frenos.",
        "quality": {
          "sourceWidth": 1106,
          "sourceHeight": 840,
          "intendedDisplayWidth": 500,
          "supportsZoom": true,
          "detailTarget": "El yoke frontal y el cuadrante de potencia del VelocityOne mostrados en la imagen oficial."
        },
        "coverage": [
          "hardware"
        ]
      },
      "tip": "Si un control no coincide con una referencia, confía en el avión y perfil que tienes cargados, no en una imagen genérica.",
      "requiredVisualCoverage": [
        {
          "type": "hardware",
          "status": "required"
        }
      ]
    }
  ],
  "practice": {
    "title": "Cabina en 60 segundos",
    "scenario": "C172 estacionado y sin intención de despegar.",
    "task": "Sin tocar potencia, haz un recorrido y nombra yoke, frenos, trim, fuente de actitud y fuente de velocidad. Repite hasta completar en menos de un minuto.",
    "successSignal": "Puedes ubicar las cinco funciones sin mover el avión."
  },
  "commonMistakes": [
    {
      "mistake": "Confundir una referencia visual con la cabina exacta de tu variante.",
      "recovery": "Comprueba el nombre de la variante y usa la ayuda interactiva de MSFS."
    },
    {
      "mistake": "Empezar a buscar botones mientras el avión se mueve.",
      "recovery": "Detente, aplica freno y vuelve a una posición segura."
    }
  ],
  "checklist": [
    "C172 cargado inmóvil",
    "Yoke ubicado",
    "Potencia identificada",
    "Frenos y trim identificados",
    "Información de actitud reconocida",
    "Información de velocidad reconocida"
  ],
  "quiz": [
    {
      "question": "¿Cuál es el propósito de esta primera exploración?",
      "options": [
        "Memorizar todos los números del panel",
        "Ubicar funciones y fuentes de información sin presión",
        "Preparar una aproximación IFR"
      ],
      "answer": "Ubicar funciones y fuentes de información sin presión",
      "explanation": "Los procedimientos y números llegarán después de dominar las referencias básicas."
    }
  ],
  "completionCriteria": [
    "Puedes señalar cinco funciones básicas en tu C172",
    "Has completado el recorrido con el avión inmóvil"
  ],
  "sources": [
    {
      "title": "Cessna 172 Skyhawk",
      "url": "https://cessna.txtav.com/en/piston/cessna-skyhawk",
      "verified": true
    },
    {
      "title": "Garmin G1000 NXi Pilot's Guide",
      "url": "https://static.garmin.com/pumac/190-02177-00_A.pdf",
      "verified": true
    }
  ]
}
